{
  "$schema": "https://json-schema.org/draft/2020-12/schema",
  "$id": "https://schedule.allegedly-media.com/api/contracts/draft-planning.read.schema.json",
  "title": "Signal Schedule Draft Planning Read Contract",
  "type": "object",
  "required": ["meta", "summary", "draftRuns", "moveQueue", "publishChecklist", "rules"],
  "properties": {
    "meta": { "type": "object" },
    "summary": { "type": "object" },
    "draftRuns": { "type": "array", "items": { "type": "object" } },
    "moveQueue": { "type": "array", "items": { "type": "object" } },
    "publishChecklist": { "type": "array", "items": { "type": "object" } },
    "rules": { "type": "array", "items": { "type": "string" } }
  }
}
